{
  "objects": [
    {
      "type": "cylinder",
      "position": [ 0, -15, -80 ],
      "radius": 2,
      "height": 5,
      "material": {
        "type": "solid",
        "colour": [ 1, 0, 0, 0 ]
      }
    },
    {
      "type": "cone",
      "position": [ -10, -15, -80 ],
      "radius": 2,
      "height": 5,
      "material": {
        "type": "solid",
        "colour": [ 1, 0, 0, 0 ]
      }
    },
    {
      "type": "sphere",
      "position": [ 0, 15, -80 ],
      "radius": 5,
      "material": {
        "type": "solid",
        "colour": [ 1, 0, 0, 0 ]
      }
    }
  ],
  "ambientColour": [ 0.2, 0.2, 0.2 ],
  "backgroundColour": {},
  "lights": [
    {
      "type": "direction",
      "direction": [ -10, -40, -3 ],
      "colour": [ 1, 1, 1 ]
    }
  ]
}